{
  "$schema": "https://json-schema.org/draft/2020-12/schema",
  "$id": "skills-catalog/model-routing/profiles.schema.json",
  "title": "Perfiles de modelo por fase SDD (model-routing E1)",
  "description": "Declaración de perfiles de modelo por fase del pipeline SDD, resueltos contra el catálogo del runtime vía la interfaz list()/resolve(phase) documentada en 00-meta-skills/sdd-orchestrator/references/model-routing.md. Configuración declarativa: sin comandos de runtime, sin TUI obligatoria. Incluye además la forma del bloque `providers` de proveedores custom (contrato de `_shared/agent-roster/profiles.json`): id → { baseURL, apiKeyEnv, models }; la credencial se referencia por variable de entorno y la clave nunca se persiste en claro.",
  "type": "object",
  "required": ["version", "phases"],
  "additionalProperties": false,
  "properties": {
    "version": {
      "const": 1,
      "description": "Versión del formato de perfiles."
    },
    "defaultAlias": {
      "type": "string",
      "minLength": 1,
      "description": "Alias por defecto para fases sin perfil propio y para degradación cuando un alias no existe en el catálogo."
    },
    "notes": {
      "type": "string",
      "minLength": 1,
      "description": "Notas libres sobre la intención del perfilado."
    },
    "phases": {
      "type": "object",
      "additionalProperties": false,
      "description": "Una entrada por rol ODD o fase del pipeline SDD. Objeto vacío = hereda defaultAlias.",
      "properties": {
        "orchestrator": { "$ref": "#/$defs/phaseProfile" },
        "explorer": { "$ref": "#/$defs/phaseProfile" },
        "writer": { "$ref": "#/$defs/phaseProfile" },
        "verifier": { "$ref": "#/$defs/phaseProfile" },
        "judge-a": { "$ref": "#/$defs/phaseProfile" },
        "judge-b": { "$ref": "#/$defs/phaseProfile" },
        "fix-agent": { "$ref": "#/$defs/phaseProfile" },
        "propose": { "$ref": "#/$defs/phaseProfile" },
        "spec": { "$ref": "#/$defs/phaseProfile" },
        "design": { "$ref": "#/$defs/phaseProfile" },
        "tasks": { "$ref": "#/$defs/phaseProfile" },
        "apply": { "$ref": "#/$defs/phaseProfile" },
        "verify": { "$ref": "#/$defs/phaseProfile" },
        "init": { "$ref": "#/$defs/phaseProfile" },
        "research": { "$ref": "#/$defs/phaseProfile" },
        "archive": { "$ref": "#/$defs/phaseProfile" },
        "judgment-day": { "$ref": "#/$defs/phaseProfile" }
      }
    },
    "providers": {
      "type": "object",
      "description": "Bloque de proveedores custom por id (contrato de _shared/agent-roster/profiles.json): se persiste con `set-models.mjs --save-provider` y se inyecta en la configuración del runtime (OpenCode) o se reporta como limitación (dsh).",
      "additionalProperties": { "$ref": "#/$defs/providerEntry" }
    }
  },
  "$defs": {
    "phaseProfile": {
      "type": "object",
      "additionalProperties": false,
      "description": "Objeto vacío = la fase hereda defaultAlias. Un perfil propio exige alias (provider/notes son opcionales junto a alias).",
      "oneOf": [
        {
          "maxProperties": 0,
          "description": "Sin perfil propio: la fase hereda defaultAlias."
        },
        {
          "required": ["alias"],
          "description": "Perfil propio: alias obligatorio; provider y notes opcionales."
        }
      ],
      "properties": {
        "alias": {
          "type": "string",
          "minLength": 1,
          "description": "Alias lógico del modelo; se resuelve contra list() del runtime actual."
        },
        "provider": {
          "type": "string",
          "minLength": 1,
          "description": "Opcional: proveedor esperado del alias, informativo."
        },
        "notes": {
          "type": "string",
          "minLength": 1,
          "description": "Opcional: motivo de la asignación de esta fase."
        }
      }
    },
    "providerEntry": {
      "type": "object",
      "required": ["baseURL", "apiKeyEnv", "models"],
      "additionalProperties": false,
      "description": "Provider custom: endpoint, variable de entorno que porta la credencial y modelos servidos. La clave nunca se persiste en claro: apiKeyEnv es el NOMBRE de la env-var.",
      "properties": {
        "baseURL": {
          "type": "string",
          "minLength": 1,
          "description": "URL base del endpoint del provider."
        },
        "apiKeyEnv": {
          "type": "string",
          "minLength": 1,
          "description": "Nombre de la variable de entorno con la API key (p. ej. OPENCODE_GO_API_KEY)."
        },
        "models": {
          "type": "array",
          "minItems": 1,
          "items": { "type": "string", "minLength": 1 },
          "description": "Ids de modelo servidos por el provider."
        }
      }
    }
  }
}
