{
  "version": 1,
  "defaultAlias": "sonnet",
  "notes": "Ejemplo ilustrativo de perfiles por rol ODD y fase; los alias cobran sentido al resolverse contra el catalogo del runtime actual (interfaz list()/resolve(role)).",
  "phases": {
    "orchestrator": { "alias": "opus", "notes": "Orquestacion de alto nivel y descomposicion de tareas" },
    "explorer": { "alias": "haiku", "notes": "Exploracion y mapeo de codigo de solo lectura" },
    "writer": { "alias": "sonnet", "notes": "Implementacion acotada por tarea" },
    "verifier": { "alias": "sonnet", "notes": "Verificacion de unit commits y checks" },
    "judge-a": { "alias": "opus", "notes": "Revision adversarial independiente" },
    "judge-b": { "alias": "opus", "notes": "Revision adversarial independiente" },
    "fix-agent": { "alias": "sonnet", "notes": "Fixes quirurgicos de hallazgos" }
  }
}

